{
    "$schema": "http://json-schema.org/draft-07/schema#",
    "title": "Hatch Package Metadata",
    "description": "Schema for Hatch MCP Server package metadata",
    "type": "object",
    "required": ["name", "version", "entry_point"],
    "properties": {
        "name": {
            "type": "string",
            "description": "Package identifier",
            "pattern": "^[a-z0-9_]+$"
        },
        "version": {
            "type": "string",
            "description": "Semantic version of the package",
            "pattern": "^\\d+(\\.\\d+)*$"
        },
        "description": {
            "type": "string",
            "description": "Human-readable description of the package"
        },
        "category": {
            "type": "string",
            "description": "Scientific domain or category"
        },
        "tags": {
            "type": "array",
            "items": {"type": "string"},
            "description": "Keywords for discovery"
        },
        "author": {
            "type": "object",
            "properties": {
                "name": {"type": "string"},
                "email": {"type": "string", "format": "email"}
            },
            "required": ["name"]
        },
        "contributors": {
            "type": "array",
            "items": {
                "type": "object",
                "properties": {
                    "name": {"type": "string"},
                    "email": {"type": "string", "format": "email"}
                },
                "required": ["name"]
            }
        },
        "license": {"type": "string"},
        "repository": {"type": "string", "format": "uri"},
        "documentation": {"type": "string", "format": "uri"},
        "dependencies": {
            "type": "array",
            "items": {
                "type": "object",
                "required": ["name"],
                "properties": {
                    "name": {
                        "type": "string",
                        "pattern": "^[a-z0-9_]+$",
                        "description": "Name of the dependent package"
                    },
                    "version_constraint": {
                        "type": "string",
                        "pattern": "^\\s*(==|>=|<=|!=)\\s*\\d+(\\.\\d+)*$",
                        "description": "Version constraint (e.g., '>=1.0.0', '==1.2.3')"
                    }
                }
            },
            "description": "Other Hatch packages required. Local dependencies are not allowed."
        },
        "python_dependencies": {
            "type": "array",
            "items": {
                "type": "object",
                "required": ["name"],
                "properties": {
                    "name": {
                        "type": "string",
                        "pattern": "^[a-z0-9-]+$",
                        "description": "Name of the Python package"
                    },
                    "version_constraint": {
                        "type": "string",
                        "pattern": "^\\s*(==|>=|<=|!=)\\s*\\d+(\\.\\d+)*$",
                        "description": "Version constraint (e.g., '>=1.0.0', '==1.2.3')"
                    },
                    "package_manager": {
                        "type": "string",
                        "enum": ["pip", "conda"],
                        "default": "pip",
                        "description": "Package manager to use for installation"
                    }
                }
            },
            "description": "Python packages required."
        },
        "compatibility": {
            "type": "object",
            "properties": {
                "hatchling": {
                    "type": "string",
                    "pattern": "^\\s*(==|>=|<=|!=)\\s*\\d+(\\.\\d+)*$",
                    "description": "Version constraint for Hatchling compatibility, e.g., '>=0.1.0'"
                },
                "python": {
                    "type": "string",
                    "pattern": "^\\s*(==|>=|<=|!=)\\s*\\d+(\\.\\d+)*$",
                    "description": "Version constraint for Python compatibility, e.g., '>=3.6'"
                }
            }
        },
        "entry_point": {"type": "string"},
        "tools": {
            "type": "array",
            "items": {
                "type": "object",
                "required": ["name", "description"],
                "properties": {
                    "name": {"type": "string"},
                    "description": {"type": "string"}
                }
            }
        },
        "citations": {
            "type": "object",
            "properties": {
                "origin": {"type": "string"},
                "mcp": {"type": "string"}
            }
        }
    },
    "additionalProperties": false
}
