{
  "name": "template_gen",
  "version": "0.1.0",
  "description": "example hatch package creation",
  "category": "example",
  "tags": [],
  "author": {
    "name": "Hatch User",
    "email": ""
  },
  "license": "MIT",
  "entry_point": "server.py",
  "tools": [
    {
      "name": "example_tool",
      "description": "Example tool function"
    }
  ],
  "citations": {
    "origin": "Origin citation for template_gen",
    "mcp": "MCP citation for template_gen"
  }
}